{
  "schema_version": "4.0",
  "id": "VU-MP-1",
  "group": "",
  "name": "SD_02-10mm",
  "label": "Velo Unterstand: Stabdübel 4x 10mm Durchmesser",
  "norm": "bauforumstahl, Arbeitshilfe: Tragwerksplanung im Stahlbau – Gelenkige Anschlüsse",
  "norm_ref": "",
  "schema": "VU-Skizze",
  "reference": 1,
  "members": [
    {
      "name": "",
      "element": "E1"
    },
    {
      "name": "",
      "element": "E2"
    }
  ],
  "fasteners": [
    "A12",
    "A13",
    "A14",
    "A15"
  ],
  "center": {
    "mode": "centroid"
  },
  "directions": {
    "N": 0,
    "V": 90
  }
}
